{
  "schema_version": "1.0.0",
  "request_id": "11111111-1111-4111-8111-111111111111",
  "run_id": "22222222-2222-4222-8222-222222222222",
  "timestamp": "2026-04-14T10:00:00Z",
  "actor": {
    "operator_id": "boss",
    "role": "primary_user",
    "session_id": "33333333-3333-4333-8333-333333333333"
  },
  "tool": {
    "name": "terminal",
    "action": "run_command",
    "version": "1.0.0"
  },
  "target": {
    "scope": "local",
    "environment": "dev"
  },
  "parameters": {
    "command": "Get-Process",
    "working_directory": "C:/Users/samai/Desktop/FRIDAY"
  },
  "policy_context": {
    "risk_tier": "low",
    "requires_approval": false,
    "justification": "Read-only process inspection"
  },
  "execution": {
    "timeout_ms": 30000,
    "retry": {
      "max_attempts": 1,
      "backoff_ms": 0
    },
    "dry_run": false,
    "idempotency_key": "req-1111"
  },
  "trace": {
    "trace_id": "aaaaaaaaaaaaaaaaaaaaaaaaaaaaaaaa",
    "span_id": "bbbbbbbbbbbbbbbb",
    "correlation_id": "44444444-4444-4444-8444-444444444444"
  },
  "metadata": {
    "phase": "P1",
    "task": "P1-T1"
  }
}
